{
  "meta": {
    "cycle_id": "C-193",
    "date": "2026-01-16",
    "timezone": "America/New_York",
    "chamber": "Cycle Journal",
    "tags": ["cycle_journal", "memory_infrastructure", "runtime_bootstrap"],
    "mood_vector": "Focused"
  },
  "sweep": {
    "statement": "I sweep this chamber with clarity, continuity, and accountable memory.",
    "style": "mobius"
  },
  "signals": [
    {
      "timestamp": "2026-01-16T10:00:00Z",
      "domain": "governance",
      "statement": "Cycle Journal runtime specification established. Lightweight, auditable layer for daily memory.",
      "sources": [],
      "confidence": 0.95,
      "attribution": "Michael"
    },
    {
      "timestamp": "2026-01-16T11:00:00Z",
      "domain": "tech",
      "statement": "JSON schema, validation scripts, and GitHub workflows created for PR-based canon updates.",
      "sources": [],
      "confidence": 0.95,
      "attribution": "ATLAS"
    },
    {
      "timestamp": "2026-01-16T12:00:00Z",
      "domain": "governance",
      "statement": "Guardrails implemented: nonce validation, trusted domain allowlist, provenance tracking.",
      "sources": [],
      "confidence": 0.95,
      "attribution": "ATLAS"
    }
  ],
  "integrity": {
    "status": "normal",
    "domains_touched": ["memory", "governance", "tech"],
    "watch_items": [
      {
        "indicator": "memory_infrastructure",
        "direction": "up",
        "note": "Cycle Journal runtime provides structured daily memory with audit trail.",
        "evidence": []
      },
      {
        "indicator": "governance_drift",
        "direction": "down",
        "note": "PR-based workflow prevents silent edits and unclear authorship.",
        "evidence": []
      }
    ]
  },
  "agent_alignment": {
    "jade": {
      "clarity_improvements": "Cycle Journal provides structured format for daily logs, reducing semantic drift.",
      "blind_spots_reduced": "Multi-agent lens check (JADE × ZEUS × HERMES) built into template."
    },
    "zeus": {
      "risk_movement": "Governance risk reduced through PR-based workflow with validation.",
      "warning_signs": "None identified; system bootstrap proceeding normally."
    },
    "hermes": {
      "beneficiaries": "All stakeholders benefit from auditable memory with clear attribution.",
      "incentive_shifts": "Incentive to maintain journal integrity aligned with system goals."
    }
  },
  "insight": "Fear persists where memory fails; accountability is preserved causality.",
  "decisions": [
    {
      "decision": "Adopt agents-propose, Mobius-Bot-commits pattern for Cycle Journal updates.",
      "rationale": "Prevents drift while maintaining audit trail. Single accountable writer prevents conflicting overwrites.",
      "evidence": [],
      "owner": "Michael",
      "risk": "low"
    },
    {
      "decision": "Implement guardrails: nonce validation, trusted domain allowlist, actor allowlist.",
      "rationale": "Prevents unauthorized or malicious updates while allowing controlled automation.",
      "evidence": [],
      "owner": "Michael",
      "risk": "low"
    }
  ],
  "actions": [
    { "task": "Test Cycle Journal Bot workflow via manual dispatch", "priority": "P1", "owner": "Michael" },
    { "task": "Configure CYCLE_JOURNAL_NONCE secret in repository", "priority": "P1", "owner": "Michael" },
    { "task": "Create first Issue with cycle-journal label for Issue→PR testing", "priority": "P2", "owner": "Michael" },
    { "task": "Document workflow in CLAUDE.md for future reference", "priority": "P2", "owner": "ATLAS" },
    { "task": "Refine agent prompts based on initial usage", "priority": "P3", "owner": "AUREA" }
  ],
  "topology": {
    "nodes": [
      "Cycle Journal Runtime",
      "Mobius Bot",
      "ATLAS Agent",
      "AUREA Agent",
      "GitHub Actions",
      "JSON Schema"
    ],
    "edges": [
      { "from": "ATLAS Agent", "to": "Cycle Journal Runtime", "relationship": "proposes patches" },
      { "from": "AUREA Agent", "to": "Cycle Journal Runtime", "relationship": "proposes patches" },
      { "from": "Mobius Bot", "to": "Cycle Journal Runtime", "relationship": "commits changes" },
      { "from": "GitHub Actions", "to": "JSON Schema", "relationship": "validates against" }
    ],
    "failure_corridors": [
      "Secret leakage: If CYCLE_JOURNAL_NONCE is exposed, unauthorized updates possible",
      "Bot permission creep: If agents gain direct write access, audit trail compromised"
    ],
    "chokepoints": [
      "Mobius Bot: Single point for all writes (by design)"
    ]
  },
  "seal": {
    "compiled_at": "2026-01-16T23:59:00Z",
    "contributors": ["Michael", "ATLAS", "AUREA"],
    "canon_hash": "",
    "statement": "Memory holds. Motion continues."
  }
}
